,Index,date,link,title_zh,proposal_zh,benefits_zh,upvotes,threshold,date.1,num_followers,num_comments,GA,proposer,Category,proposal_en,title_en,Unnamed: 16,Unnamed: 17,Unnamed: 18,Unnamed: 19,Unnamed: 20,Unnamed: 21,Unnamed: 22
130,130,2017-03-15 16:05:20,https://join.gov.tw/idea/detail/9e9bff81-a1ce-4812-9270-b5936285465a,提升全民行車觀念，以提升全民行車環境品質，解除禁行機慢車道，解除強制二段式左轉,"1.相信大家之前都有看到一則新聞，真的是見識到台灣民眾開(騎)車的觀念極差至極，日前在高雄，有一台汽車為了搶快闖紅燈，機車駕駛問汽車駕駛，沒看到你們變紅燈嗎?汽車駕駛回覆，沒有啊我瞎了阿，車上還坐了汽車駕駛的小孩。這種駕駛人的觀念，實在令人髮指！ 
希望政府能推動一系列的安駕講習，例如新竹安駕中心，以新竹安駕中心為主，規劃一系列的安全駕駛講座，各縣市例如監理站為輔，輔助講座的落實，以提升全台民眾駕駛觀念，降低""三寶車禍的發生""2.藉由提升駕駛的觀念，解除禁行機慢車道，降低機車行駛於外側車道，與違停車輛造成的擦撞與摩擦。3.解除強制二段式左轉，使汽/機車駕駛都能夠有最有效率，最安全的方式回家/上班。待轉區變成待撞區",1.藉由提升全民的安全駕駛觀念，可使汽/機車，能夠安全，和平的共用車道，也可以用最有效率的方式達到最高的交通疏通量，不需要在挪經費出來在路面上寫進行車慢車2.解除禁行機慢車道後，因提升行車觀念，使汽/機車可以和平共道，能夠省下更多的經費開闢新的一條機慢車繞道1.可以省去更多的道路維修保養經費2.可以減少更多的環境破壞3.左轉往左邊車道靠，右轉往右邊車道靠，這是最基本的觀念，但往往許多汽車駕駛因為外側有機車，而導致都要到路口才能停下來緩慢通過，在緩慢通過的期間，被他轉彎中阻擋的汽/機車駕駛，都需要因為他而減速，降低交通的效率，因此落實左轉靠左、右轉靠右，不僅僅是汽車駕駛才需要做到，機車駕駛也可以做到，以Youtube連結為例(特別感謝TaibeiMoto．台北摩多授權提供):安全左轉機車也是能夠做到的，在全民駕駛觀念的提升後，好處不勝枚舉。提升全民行車觀念：1.汽/機車能夠安全共道，有效率的提升交通疏導量2.無須多挪出經費維護保養多出來的繞道，以及在路面上寫進行機慢車道3.使機車也能夠安全左轉，無須再多挪出經費設置待轉區解除禁行機慢車道：1.使機車能夠安全行駛於車道內，不必被強制規定行駛於外側，導致與外側違停車輛發生擦撞，更安全2.可以將外側車道規畫成更多的停車格與車道有所區隔，使所有車輛都能夠安全行駛，也能相對解決停車問題解除強制二段式左轉：1.無須因為汽車駕駛恍惚，而使待轉區變成待撞區，更安全2.等到路口無車，或是左轉燈號亮起直接左轉，提升行車效率,5397,5000,2017-03-15 16:05:31,486,0,無,楊小樺,,"1. I believe everyone has seen a piece of news before. I really saw that the concept of driving (riding) cars in Taiwan is extremely bad. In Kaohsiung a few days ago, a car ran a red light in order to rush. This kind of driver's concept is really outrageous! It is hoped that the government can promote a series of safe driving lectures, such as the Hsinchu Safe Driving Center. The Hsinchu Safe Driving Center will plan a series of safe driving lectures, and the counties and cities, such as supervision stations, will assist in the implementation of the lectures, so as to improve the driving concept of the entire Taiwan people and reduce the occurrence of ""Sambo car accidents"". 3. Remove the forced two-stage left turn, so that the car/locomotive driver can have the most efficient and safest way to go home/work. Waiting area becomes waiting area","Promote the concept of driving for the whole people to improve the quality of the driving environment for the whole people, lift the slow lane of prohibited traffic, and lift the mandatory two-stage left turn",,,,,,,
128,128,2016-05-25 12:38:24,https://join.gov.tw/idea/detail/40ac6c53-4ad7-415e-970b-afbcaeadf9c6,以開放透明、公共參與的方式解決網路叫車平台爭議,"台灣社會乃至全球，於網路叫車平台（Uber 等）議題看法高度分歧，交通部長賀陳旦就任前也認為：「⋯⋯Uber 問題才是真正的挑戰，不能用合法與否或罰款來解決⋯⋯。」並表示：「這已不能靠單一法令一直取締可解決，還要考量消費者期待，若法律比較落伍就什麼都不能做了，未來將參考國外做法有限度開放 Uber。」當時甚至還被媒體譽為「終於等到想處理 Uber 問題的交通部長」。然而，賀陳旦部長就任後，交通部唯一的處方就是與六都警力合作，針對 Uber 展開前所未有的中央地方聯合大稽查。
 
蔡英文總統當選前喊出「史上最會溝通的政府」，並於就職演說強調人民的期待就是「解決問題」，新政府執政後將如何落實至各層次尚不清楚，但即便過去被認為不怎麼會溝通的政府，尚且經由全民協作，於去年修訂完成「網路政策白皮書」 ，將「調適共享經濟法制」列為相關政策推動及全民參與公共事務的行動方案之一。日前新舊政府交接項目之一的「法規政策影響評估制度規劃構想」，也明言制訂管制措施時，應廣泛納入公眾意見，以減少日後衍生爭議，避免耗損溝通與法規調整成本。
 
針對該等平台合法性，交通部原稱：「⋯⋯由於此類業者並非從事公路法規定之汽車運輸業務⋯⋯將就資料蒐集後⋯⋯會等相關主管機關適時進行調查。」實則僅就「爭議是否涉及政府其他主管機關權管法令部分函請相關主管機關協助釐清」，並無調查報告。再以「現行規定未臻明確，為避免產生爭議」為由，逕自修正計程車客運服務業申請核准經營辦法，並據此判定平台違法。後又修正自用車違規營業處罰基準表，對駕駛加重處罰。以上情事共同特徵即為決策不透明，沒有與各界溝通，更未納入公眾意見。
 
事實上，新舊政府交通部始終缺乏開放決策作為，更時常站在對立面。在以凝聚共識為目的之虛擬世界法規調適交流平台上，煙火般的意見徵集與諮詢會議過後，至今已近九個月，交通部連討論案都尚未提出，遑論後續的討論、建議、草案，與定案。然自 Uber 等平台進入台灣以來，法規鬆綁論述不知凡幾，交通部閉門會議或民間自辦座談中，也不乏各方專家學者倡言應調適法規以因應創新，法規不宜墨守成規更是前述意見徵集階段之共同意見。換言之，交通部的所作所為，都是在沒有社會共識，高度爭議狀態下的獨斷獨為。
 
為實質化解爭議，本提議具體建議如下： 

公開過往交通部相關諮詢會議記錄，並闡明其與交通部決策之間的關係；
進行網路叫車平台實證調查研究，確認其於公共福利與交通安全之影響；
提出國家共享經濟策略，實施管制影響評估，研擬是否管制與如何管制；
參酌意見徵集與諮詢會議之結果，提出網路叫車平台與計程車業法規調適討論案，並納入使用者為利害關係人，進入後續討論等各階段；
暫停訴訟與取締，但如有需要，繼續對行為人蒐證。
","目前爭議聚焦之網路叫車平台，其實只是邁向無人駕駛的過渡階段，在更大幅度機器取代人力的日子來臨時，不僅運輸產業將受影響，而是所有行業都會受到巨大衝擊，也因此有許多工作機會銳減的預測，政府在過程中如何治理，攸關人民是否能平順迎向未來，所以政府如何化解本件爭議，實具有指標意義。
 
從這角度來看，交通部僅針對特定服務參與者開罰的做法，至多只能在一段時間內，將特定行業圈在一個或許僅能糊口的框架，而無助於因應未來。如果政府拿不出真正的辦法，為什麼不開放決策集思廣益呢？
 
「⋯⋯這些活潑的平台要求開放，而這個開放裡面最大的挑戰就是在於政府自己願不願意開放，不管從法令，資訊還有心態來做這件事情。」－賀陳旦，「共享經濟 創造新竹價值」科技論壇導言
 
期待部長找回過往的自己，領導交通部開放決策有什麼困難，請讓公民做為你的後盾。",5419,5000,2016-06-15 18:19:03,733,0,無,nchild,,"Taiwanese society and the whole world have highly divided opinions on the issue of online car-hailing platforms (Uber, etc.). Before taking office, Minister of Transportation He Chendan also believed: ""...Uber's problem is the real challenge, and it cannot be solved by whether it is legal or not or fines...."" Minister of Transport"". However, after Minister He Chendan took office, the only prescription for the Ministry of Communications was to cooperate with the police forces in Liudu to launch an unprecedented central and local joint inspection of Uber. President Tsai Ing-wen called out ""the most communicative government in history"" before she was elected, and emphasized in her inaugural speech that the people's expectation is to ""solve problems"". It is not clear how the new government will implement it at all levels after it takes office, but even the government, which was considered to be not very communicative in the past, revised and completed the ""Internet Policy White Paper"" last year through the cooperation of the whole people, and listed ""adjusting the sharing economy legal system"" as one of the action plans for relevant policy promotion and public participation in public affairs. Recently, the ""Planning Conception of Regulations and Policies Impact Assessment System"", one of the handover projects between the old and new governments, also stated that when formulating control measures, public opinions should be widely included in order to reduce future derivative disputes and avoid wasting communication and regulatory adjustment costs. Regarding the legality of these platforms, the Ministry of Communications originally stated: ""...Since such operators are not engaged in the automobile transportation business stipulated in the Highway Law... After collecting data...the relevant competent authorities will conduct an investigation in due course."" In fact, only ""whether the dispute involves other government agencies' powers and regulations"" will be sent to the relevant competent authorities for assistance in clarifying, and there is no investigation report. Then, on the grounds that ""the current regulations are not yet clear, in order to avoid disputes"", they directly amended the procedures for the application and approval of the taxi passenger transport service industry, and based on this, the platform was determined to be illegal. Later, the benchmark table of penalties for violations of self-use vehicles was revised, and penalties for driving were increased. The common feature of the above cases is that the decision-making is not transparent, there is no communication with all walks of life, and it has not been included in public opinion. In fact, the Ministry of Communications of the old and new governments has always lacked open decision-making actions, and often stands on the opposite side. It has been nearly nine months since the pyrotechnic opinion collection and consultation meeting on the virtual world regulation adjustment exchange platform aimed at building consensus, and the Ministry of Communications has not even proposed a discussion proposal, let alone subsequent discussions, suggestions, drafts, and finalized decisions. However, since Uber and other platforms entered Taiwan, there have been many discussions on the loosening of laws and regulations. In the closed-door meeting of the Ministry of Communications or private forums, there are many experts and scholars from various parties who advocate that laws and regulations should be adjusted to cope with innovation. It is the common opinion of the above-mentioned opinion collection stage that laws and regulations should not be rigid. In other words, what the Ministry of Communications did was arbitrary without social consensus and in a state of high controversy. In order to substantively resolve the dispute, the specific suggestions of this proposal are as follows: disclose the records of previous consultation meetings of the Ministry of Communications, and clarify the relationship between them and the decisions made by the Ministry of Communications; conduct empirical research on online car-hailing platforms to confirm their impact on public welfare and traffic safety; propose a national sharing economy strategy, implement regulatory impact assessments, and study whether and how to regulate; consider the results of opinion solicitation and consultation meetings, propose a discussion on the adjustment of online car-hailing platforms and taxi industry regulations, and include users as stakeholders, and enter the follow-up discussion and other stages; suspend litigation And ban, but if necessary, continue to search for evidence on the perpetrator.","Resolve disputes over online car-hailing platforms in an open, transparent and public-participatory manner",,,,,,,
142,142,2019-02-28 22:01:55,https://join.gov.tw/idea/detail/35980390-9f59-4856-8f4a-98e88fbcd05e,提議立網約車專法，保護租賃業與代僱駕駛的就業權利,舊的交通法規，無法適合新的科技平台形式，不論怎麼修改都漏洞百出！建議重新訂立網約車平台專法，保護創新平台與代僱駕駛的就業權。,"租賃業者與科技平台的合作，早已經合法，交通部卻因為計程車的施壓，企圖於原有法規上進行修改，來打壓租賃業者與代僱駕駛的生存空間！ 
之前已經宣告合法，現在又修法打壓，有違法律的信任原則！並且對投入資金的業者造成極大的損失！ 
舊的法令不論怎麼修改都漏洞百出，建議另立專章新法，符合時代的潮流與趨勢！",5352,5000,2019-02-28 22:04:50,825,0,無,Miss J,,"The old traffic regulations cannot be adapted to the new technological platform form, no matter how they are modified, they will be full of loopholes! It is recommended to re-establish the special law on online car-hailing platforms to protect the employment rights of innovative platforms and hired drivers.",Propose the establishment of a special law on online car-hailing to protect the employment rights of the leasing industry and hired drivers,,,,,,,
